{
  "$schema": "https://json-schema.org/draft/2020-12/schema",
  "$id": "fix-result.schema.json",
  "title": "Fix Agent Result",
  "description": "Structured output from the fix agent documenting actions taken on review feedback.",
  "type": "object",
  "required": ["pr_number", "trigger_source", "actions", "summary", "tests_passed", "files_changed"],
  "additionalProperties": false,
  "properties": {
    "pr_number": {
      "type": "integer",
      "description": "The PR number that was fixed."
    },
    "trigger_source": {
      "type": "string",
      "enum": ["bot", "human"],
      "description": "Whether the fix was triggered by the review bot or a human /fix command."
    },
    "iteration": {
      "type": "integer",
      "minimum": 1,
      "description": "Which iteration of the review→fix loop this is."
    },
    "actions": {
      "type": "array",
      "minItems": 1,
      "maxItems": 50,
      "description": "Actions taken on each review finding.",
      "items": {
        "type": "object",
        "required": ["type", "finding"],
        "additionalProperties": false,
        "properties": {
          "type": {
            "type": "string",
            "enum": ["fix", "disagree"],
            "description": "Action type: fix (addressed the finding), disagree (reasoned rejection)."
          },
          "finding": {
            "type": "string",
            "maxLength": 256,
            "description": "Short label for the review finding being addressed."
          },
          "path": {
            "type": "string",
            "maxLength": 512,
            "description": "File path the finding references."
          },
          "description": {
            "type": "string",
            "maxLength": 2048,
            "description": "What was done to address the finding (for fix actions)."
          },
          "reason": {
            "type": "string",
            "maxLength": 2048,
            "description": "Why the agent disagrees with the feedback (for disagree actions)."
          }
        },
        "allOf": [
          {
            "if": { "properties": { "type": { "const": "fix" } }, "required": ["type"] },
            "then": { "required": ["type", "finding", "description"] }
          },
          {
            "if": { "properties": { "type": { "const": "disagree" } }, "required": ["type"] },
            "then": { "required": ["type", "finding", "reason"] }
          }
        ]
      }
    },
    "decision_points": {
      "type": "array",
      "maxItems": 20,
      "description": "Significant decisions where alternatives were considered.",
      "items": {
        "type": "object",
        "required": ["description", "rationale"],
        "additionalProperties": false,
        "properties": {
          "description": {
            "type": "string",
            "maxLength": 2048,
            "description": "What decision was made."
          },
          "alternatives": {
            "type": "array",
            "items": { "type": "string", "maxLength": 256 },
            "description": "Other approaches that were considered."
          },
          "rationale": {
            "type": "string",
            "maxLength": 2048,
            "description": "Why this approach was chosen."
          }
        }
      }
    },
    "summary": {
      "type": "string",
      "maxLength": 4096,
      "description": "Human-readable summary of what the fix agent did."
    },
    "strategy_change": {
      "type": ["string", "null"],
      "maxLength": 2048,
      "description": "If the agent changed strategy due to escalation threshold, describe the new approach."
    },
    "tests_passed": {
      "type": "boolean",
      "description": "Whether all tests passed after the fix."
    },
    "files_changed": {
      "type": "array",
      "maxItems": 100,
      "items": { "type": "string", "maxLength": 512 },
      "description": "List of files modified by the fix agent."
    },
    "rebased_onto_target": {
      "type": "boolean",
      "description": "Set to true whenever this run's HEAD reflects an authorized human rebase onto the PR's target that still needs to be published on the remote PR (see 'How to rebase' step 8 in agents/fix.md) — a completed `git rebase origin/<target>`, a step-3 no-op whose result still needs publishing (e.g. a GitLab MR reconstructed against the target), a rebase-only run with no new commit, or a validation-loop retry carrying the field forward from the iteration that performed or no-op'd the rebase. On a human rebase request the field must be present: true after success or the step-3 no-op, false if the rebase failed or was aborted. Omitting it is rejected by the validation loop (issue #1387) rather than treated as false. Never set true for a bot-triggered run. The post-script requires this field together with a harness-verified human rebase request (TRIGGER_SOURCE plus the literal /fs-fix instruction text) before skipping the replay onto the remote PR tip — ancestry alone cannot distinguish an authorized rebase from a GitLab MR reconstruction against a target that has since moved on."
    },
    "history_rewritten": {
      "type": "boolean",
      "description": "Set to true whenever this run's HEAD reflects an authorized human squash or redo/reset that still needs to be published on the remote PR (see 'Rewrite fix-agent history' in agents/fix.md), or a validation-loop retry carrying the field forward. A squash targets the whole PR range (fix-agent, code-agent, and human commits alike) and must land as exactly one commit ahead of the target branch; a redo/reset only discards and re-implements the contiguous fix-agent commit suffix, preserving every commit below it. Never set for a failed/aborted rewrite, a squash no-op (PR already a single commit), or a bot-triggered run. The post-script requires this field together with a harness-verified human squash/redo request (TRIGGER_SOURCE plus the literal /fs-fix instruction text) before skipping the replay onto the remote PR tip — for a squash it additionally refuses to publish unless exactly one commit results, and for a redo/reset it refuses to publish if a human-authored or code-agent commit below the rewrite base would be lost."
    },
    "ci_inspections": {
      "type": "array",
      "maxItems": 50,
      "description": "Project CI jobs inspected during context gathering. Omit Fullsend agent/dispatch workflows. Include up to 50 entries, prioritizing failed and pending jobs over passing ones.",
      "items": {
        "type": "object",
        "required": ["job", "classification"],
        "additionalProperties": false,
        "properties": {
          "job": {
            "type": "string",
            "minLength": 1,
            "maxLength": 256,
            "description": "Check, job, or pipeline name as reported by the CI system."
          },
          "status": {
            "type": "string",
            "maxLength": 64,
            "description": "Observed status from the CI system (for example success, failure, pending, cancelled)."
          },
          "classification": {
            "type": "string",
            "enum": [
              "passing",
              "pending",
              "pr-related",
              "unrelated",
              "flaky",
              "transient-infra"
            ],
            "description": "Diagnosis relative to this PR. passing: completed successfully. pending: still running. pr-related: failure caused by this PR's changes. unrelated: failure not caused by this PR. flaky: intermittent failure. transient-infra: infrastructure or transient platform failure. There is no dedicated value for a cancelled or skipped job: record the raw state in `status` and pick the closest classification instead — `pending` if the job may still run to completion, `transient-infra` if it was cancelled/skipped by infrastructure rather than the job's own logic, or `unrelated` if it was intentionally skipped for reasons unconnected to this PR."
          },
          "diagnosis": {
            "type": "string",
            "maxLength": 2048,
            "description": "Evidence for the classification, including what logs or artifacts were read."
          },
          "remediation": {
            "type": "string",
            "maxLength": 2048,
            "description": "What was done or recommended: a code fix applied, a request that the user rerun the job, or guidance to file an issue with the responsible owner."
          }
        }
      }
    }
  }
}
